,posting_date,description,title,employer,industry,id,source,country
24,"Sep 10, 2019","you engage with customers and consultants to get a deep understanding of our business needs and opportunities to create value from data and transfer knowhow into systems.you explain, educate, and tell stories about data driven working and thinking in the company. you are an ambassador and role model for this way of working.you pro-actively perform data exploration to come up with new insights and proposals to improve our products.you continuously tweak and adjust our predictive models to provide the best performance possible.you work with a multidisciplinary product team that innovates the predictive capabilities and data driven systems.you will build up & coach a small team of data scientists and analysts..5+ years of experience in data science.master degree or equivalent relevant work experience in a mathematical or analytical field.experience with working in a data driven product environment.excels at explaining complex data concepts to the whole company and taking people on a path of more analytical and data thinking.able to communicate ideas and strategies (including push back) up till the executive level.creative and flexible in coming up with solutions when the data itself is imperfect.excellent communication skills in english..experience in an online marketing environment.experience with our tech and tool stack: python, scala, sagemaker, databricks..flexible working hours.unlimited (paid!) holidays.time and budget for training.relocation support and more!.",Lead Data Scientist,VONQ,Advertising & Marketing,78005,Glassdoor,Netherlands
25,"Sep 10, 2019","as a member of the organization you will be dedicated to improving the reliability of our end-to-end data infrastructure. your work will integrate directly with twitter's products..our core infrastructure receives hundreds of millions of tweets per day and serves tens of billions of api requests. we also serve over 2+ billion search queries per day, render millions of ad impressions, and process hundreds of terabytes of log and interaction data daily..we dive deep into gnarly operational issues; from the software, systems, automation, and process perspectives. we will understand the challenges around integrating disparate infrastructures into a new facility, processes and procedures..we work with open-source technologies and get involved with sre and hadoop community..we actively participate in the vision to move away from high operational cost tasks such as break/fix, cluster migrations, new service buildouts, abuse, etc. you will contribute to services that can shrink and expand based on demand, self heal, automatically rollout, etc..we will train and invest in our team members to make sure that they are successful in supporting large variety of system and products that twitter use..you will use your expertise to improve the reliability and performance of hadoop clusters and data management services..you will participate in and build tools to diagnose, and fix complex distributed systems handling 10s of petabytes of data and drive opportunities to improve automation for the company, scope and create automation for deployment, management and transparency of our services..you will tackle issues across the entire stack - hardware, software, application and network..you will test, monitor, administer, and operate multiple clusters across data centers, primarily in python and java..you will take part in 24x7 on-call / support rotation..minimum 3+ years of handling services in a large scale distributed systems environment, preferably hadoop..familiarity with systems management tools (puppet, chef, capistrano, etc).knowledge of linux operating system internals, filesystems, disk/storage technologies and storage protocols and networking stack..proven knowledge of systems programming (bash and shell tools) and/or at least one scripting language (python, ruby, perl, scala)..track record of practical problem solving, excellent communication, and documentation skills.proven understanding of systems and application design, including the operational trade-offs of various designs..work well with and be able to influence a myriad of personalities at all levels..be adaptable and able to focus on the simplest, most efficient & reliable solutions..experience with hdfs, yarn and related hadoop technologies..ability to lead technical teams through design and implementation across an organization..b.s. in computer science or similar field..",Senior Site Reliability Engineer - Data Infrastructure / Hadoop,Twitter,Internet,58547,Glassdoor,
26,"Sep 10, 2019","identify new data-source in the network that will build new insights to business needs..develop etl jobs for large volume of data that is fast and reliable in a big data platform..develop big data analytic solution to analyze and link multiple data-source in the big data platform..craft new visualization software that demonstrate machine learning and predictive analytic to bring new insights and solution to the business..design, develop, code, test, improve and debug etl packages, stored procedures, and data flows..participate in design, development, and deployment of data warehouse data models..collaborate with business partners and other it teams to ensure high quality data solutions are delivered..solve operational critical issues and resolve business partner issues in a timely manner with strong collaboration and care for business priorities..document existing and new work performed..development skills with java, python, scala, or other languages.experience with relational databases (teradata, ms sql, oracle, mysql).proficiency with development tools (git/svn, artifactory, maven, jenkins).strong communication skills (written, verbal and presentation).ability to analyze problems, identify and implement solutions.ability for minimal, international travel.",Big Data Engineer,Micron,Health Care Products Manufacturing,6312,Glassdoor,TW
27,"Oct 9, 2019","requirements definition for data quality (dq) controls, thresholds, kpis and dashboards for business-critical partner and internal data utilized across sxm's systems..monitoring of the dq controls, thresholds, kpis and dashboards..data investigation and analysis for dq, it and business data requests, and related communication with a cross-functional group of sxm stakeholders as needed..researches and identifies root cause for data issues (rca), and works with the relevant sxm teams and sxm external partner leads regarding rca details and sample data to drive resolution..summarizes and explains complex analyses as needed for technical, project and business reviews..project-related data validation and dq requirements definition..development, testing/qa and validation of recurring remediations and data cleanups to resolve data issues, support delayed projects and support ad-hoc business requests..conducts data quality audits and initiates corrective actions to ensure data quality..are subject matter experts in one or more sxm data areas (e.g. tier 1 and oem data, marketing data, satellite radio signaling data)..ba/bs degree. technical degree preferred..at least 5 years of overall work experience, including demonstrated understanding of the software development life cycle..at least 5 years of experience in a subscription services or manufacturing environment..at least 5 years of demonstrated cross-functional coordination with internal and external it and business stakeholders for complex data and/or integration processes..highly analytical mindset; must have the ability to understand business and it processes and convert them to data quality and control requirements. must be able to interpret data issues and complex analyses to business owners in a clear and concise fashion..interpersonal skills and ability to interact and work with staff at all levels..excellent written and verbal communication skills..ability to work independently and in a team environment..ability to pay attention to details and be organized..ability to project professionalism over the phone and in person..ability to handle multiple tasks in a fast-paced environment..commitment to ""internal client"" and customer service principles..willingness to take initiative and to follow through on projects..excellent time management skills, with the ability to prioritize and multi-task, and work under shifting deadlines in a fast-paced environment..must have legal right to work in the u.s..thorough knowledge of ms-office suite (word, excel, powerpoint, access)..highly experienced with database systems and analytical tools..experience with high volume, high-availability applications..strong sql skills (e.g. teradata sql, oracle) are required..data quality software (e.g. talend), data visualization software (e.g. tableau, qlikview) and mdm system skills are a plus..","Senior Analyst, Data Quality",Sirius XM,Radio,161376,Glassdoor,United States
28,"Oct 9, 2019","write user manuals, data analysis to build out an automated data reporting suite that will drive decision making.compile, identify trends, and evaluate data to support the e-commerce team in decision-making.perform white box and black box testing of our e-commerce platform.regular data extraction from internal db (sql), data analytics.perform product specific analytics and customer analytics in e-commerce space.should come out with workflows in e-commerce supply chain management.develop data-driven attribution methodologies; providing cross channel insight into the effectiveness of our data driven marketing campaigns.proactively monitor web and user data to identify customer pain points, providing regular reporting and identifying ways of improving user experience.support the e-commerce team with any ad-hoc reporting requests.total work: 2 years (preferred).chennai, tamil nadu (required).software development.",E-commerce Technical Writer and Data Analyst,Akra Tech,,113832,Glassdoor,IN
29,"Oct 9, 2019","2 + years with risk management (market, liquidity, esg).2 + years with sql programming.2 + years in financial services / risk data management.2 + years with ssis.knowledge of vba, excel.analytical and problem solving.work in victoria bc.",Market Risk Data Analyst,Randstad Canada,Staffing & Outsourcing,24358,Glassdoor,CA
30,"Oct 9, 2019","intellectual prowess (highly analytical & strategic).strong relationship management/interpersonal skills.complex problem-solving, innovative and creative thinking.excellent communication and presentation skills.versatile and able to work under pressure to deliver multiple projects to a high quality.high attention to detail.good to have but not essential - experienced in data visualisation -power bi.good to have but not essential - experienced with sales force crm.experienced in performing analytics, segmentation, data mining and campaign management using sql, sas, spss, google 360 or similar packages.previous experience operating large-scale crm systems or programs, plus knowledge of technology stacks, scv opportunities and partners.experience in a data analytics.experience in crm and insights with a proven track record of driving actionable insight.experienced in crm technology management, with an understanding of marketing and operational databases, segmentation, campaign management and statistical modelling.experienced in successfully managing agencies and consultant partnerships.experience in omni-channel strategy- development and implementation.plan and oversee delivery of the email marketing and crm strategy to drive online traffic and revenue targets and relevant kpis.responsibility for all newsletter and product-led email marketing.responsibility for database growth and lead development of email production processes and system integrations..plan email calendar in collaboration with online, nam and marketing stakeholders.provide data insights and analytical reports for too faced..assist too faced marketing, nam and online to provide relevant insights.tackle the challenge of extracting business intelligence from large data sets. ability to see beyond the numbers. 1st party data, 2nd party and 3rd party..proactively suggest ways to visualise complex data sets, generating charts/tables that give insightful views of key business issues and opportunities.liaises with too faced brand team to educate on the scheduling of published reports ensuring clear communication and how they can be used to identify key insights and trends - experienced in automation.strong participant and contributor to the creation, sharing and learning culture to provide inspiration and relevant information to too faced.partnering with our data agency and collaborating with the corporate media director to create scalable statistical and analytical models.",CRM & Data Analyst - Fixed Term Contract,Estée Lauder Companies,Consumer Products Manufacturing,94824,Glassdoor,United Kingdom
31,"Oct 9, 2019","ervaring met analytische scripting talen (python en r);.analytisch en communicatief sterk, kritisch, teamspeler, gestructureerd en proactief;.",Lead Data Engineering,BIJENKORF,"Department, Clothing, & Shoe Stores",73820,Glassdoor,NL
32,"Oct 9, 2019","read and analyse print and online newspapers and beauty magazines.read and analyse blogs and social media posts..analyse the articles according to our core methodology.research new products and brands that appear in the press for the first time.input all analysis into our proprietary data platform ensuring accuracy and quality of data.must be able to speak/read italian.ability to learn quickly.computer literacy (basic word and excel skills).working within a team environment.working to deadlines.an interest in the beauty industry.up to £16,000 - 17,500 dependents on experience per annum based on experience.hmrc approved employee share option scheme.25 days annual leave plus bank holiday.",Italian Data Entry Analyst,Source4 Personnel Solutions,,110082,Glassdoor,United Kingdom
33,"Oct 9, 2019","read and analyse print and online newspapers and beauty magazines.read and analyse blogs and social media posts..analyse the articles according to our core methodology.research new products and brands that appear in the press for the first time.input all analysis into our proprietary data platform ensuring accuracy and quality of data.must be able to speak/read italian.ability to learn quickly.computer literacy (basic word and excel skills).working within a team environment.working to deadlines.an interest in the beauty industry.up to £16,000 - 17,500 dependents on experience per annum based on experience.hmrc approved employee share option scheme.25 days annual leave plus bank holidays.",German Data Entry Analyst,Source4 Personnel Solutions,,69663,Glassdoor,United Kingdom
34,"Oct 9, 2019","read and analyse print and online newspapers and beauty magazines.read and analyse blogs and social media posts..analyse the articles according to our core methodology.research new products and brands that appear in the press for the first time.input all analysis into our proprietary data platform ensuring accuracy and quality of data.must be able to speak/read italian.ability to learn quickly.computer literacy (basic word and excel skills).working within a team environment.working to deadlines.an interest in the beauty industry.up to £16,000 - 17,500 dependents on experience per annum based on experience.hmrc approved employee share option scheme.25 days annual leave plus bank holidays.",Spanish Data Entry Analyst,Source4 Personnel Solutions,,93651,Glassdoor,United Kingdom
35,"Oct 8, 2019","bachelor's/college degree in mathematics, statistics, economics or equivalent.must have good working experience as statistician /data analyst/ mathematician.knowledgeable in evaluating probabilities and statistics, statistical modeling and graphic analysis, charts and tables.can interpret data, analyze results using statistical techniques, provide ongoing reports and data sets.",Statistician/ Data Scientist,Glimex Inc.,,57684,Glassdoor,PH
36,"Oct 7, 2019","preferably master or phd in scientific field;.analytics background;.strong visualization skills - tableau;.excellence in python;.geospatial experience - gis, arcgis, qgis;.desirable - experience with azure..",Senior Data Scientist,Stott and May,Staffing & Outsourcing,123367,Glassdoor,United Kingdom
37,"Oct 7, 2019","provide data and reporting support as requested by external business partners in support of existing service agreements.understand the usage and relevance of company data sources and policy and claims admin systems in relation to financial r and ensure availability of data for all relevant data sources and lines of business..review and evaluate internal processes for effectiveness and efficiency and recommend alternative approaches and solution.enhance the consistency, quality and timeliness of reporting..bachelor’s degree or equivalent combination of education and work experience.minimum 2 years' relevant experience using microsoft sql server.proficient in sql programming, and sql server integration services to manage data loads and queries.experience integrating various data sources using open data source connectivity(odbc) and linked servers, etc..excellent verbal and written communication skills.ability to work with little supervision and self-review to produce quality outcome..working knowledge of microsoft office, including excel functions, pivot tables and macros, plus ms access query design.ability to meet firm deadlines in a fast paced environment; manage one’s own time.adapt and be flexible in a complex changing environment.use statistical techniques and a methodological approach to solve data issues.familiarity with insurance premium and claims is a plus.familiarity with python, luigi or airflow data pipeline framework is a plus.experience with government regulator filings is a plus..sql server: 3 years (preferred).",SQL Data Analyst/Analista de Datos SQL,Integon Co SA de CV,,111202,Glassdoor,MX
38,"Oct 7, 2019","you will be responsible for making the current algorithm more bulletproof while delivering new algorithms and products to power their analysis platform..you will be working on advanced time series models along with addressing various other challenges within machine learning, modelling and analytics..you will lay the groundwork for the future of their data science practice, designing, implementing and launching your own products, features and frameworks..msc or phd in statistics, applied mathematics, computer science, physics from a top tier university (oxford, cambridge, harvard etc).strong background in statistical modelling and delivering data science projects..experience with the following; supervises and unsupervised ml, time series analysis, outlier detection)..ability to write python (various libraries), and preferably r too..",Senior Data Scientist,Pivotal London,Staffing & Outsourcing,98083,Glassdoor,United Kingdom
39,"Oct 7, 2019","conduct algorithmic r&d over speech and vision data..experiment with various ml platforms suitable for video analytics.work intensively with different types of data arriving from multiple sources and channels.interact with customers to formalize requests and requirements into algorithmic constraints.work closely with the product & engineering teams in designing and implementing solutions.msc/phd/equivalent in cs/ee/physics or a related field.at least 7 years’ experience in machine learning and/or data mining theory and algorithms.extensive experience with algorithm development for various types of data.extensive experience with algorithmic coding as well as with real data testing.extensive programming experience in languages such as python/c#/c++/java.ability to lead collaborative technical projects from conception to successful implementation.outstanding communication skills, comfortable in front of customers and a team player.independent, capable of making decisions in an ambiguous environment.",Senior Data Scientist ASME IL Data Science Group,Microsoft,Computer Hardware & Software,144326,Glassdoor,Israel
40,"Oct 5, 2019","experience building complex etl pipelines using python.proven experience with aws stack.some knowledge of big data related tools and techniques.you will be using aws, python and sql to interpret data from a wide range of sources and deliver it to all parts of the business.work closely with the product owners, designers and other engineers to design and refine the work.helping to develop their data lake and data warehouse.",Senior Data Engineer,X4 Group,Staffing & Outsourcing,124002,Glassdoor,United Kingdom
41,"Oct 4, 2019",excel: 1 year (preferred).,Market Data Management Analyst,MDSL,Enterprise Software & Network Solutions,29519,Glassdoor,Kingdom
42,"Oct 4, 2019","handson experience in data engineering including knowledge in implementing best of class tools, technologies and practices..previous experience in building up data pipelines and infrastructure from scratch.proven background within scripting (e.g. bash, python, ruby, perl, php).experience with the hadoop stack (hdfs, pig, hive, zookeeper, oozie, flume, spark).proficiency in a sql dialect and familiarity with one or more schema definition languages (e.g. ddl, sdl).experience with deployment and management of a nosql database (e.g. couchdb, mongodb) is desirable.solid knowledge and expertise across data integration and data management.experience with data warehousing solutions and visualisation tools (e.g. tableau).**to find out more about computer futures please visit ######.###***.",Senior Data Engineer,Computer Futures,IT Services,140994,Glassdoor,United Kingdom
43,"Oct 4, 2019","5+ years in a leadership/management capacity around data engineering, building a data warehouse, data marts, and data pipelines..experience partnering with business teams to architect and strategize technology and data roadmap..experience with big data architectures and data modeling to efficiently process large volumes of data..background in etl and data processing, know how to transform data to meet business goals..experience developing large data processing pipelines on apache spark..experience with python or java programming languages..strong understanding of sql and working knowledge of using sql for various reporting and transformation needs..excellent communication, adaptability and collaboration skills..experience running agile methodology and applying agile to data engineering..excellent verbal and written communication skills..strong communication skills..able to clearly express opinions on product design, while respecting the thoughts and opinions of their peers..proven ability to communicate and collaborate effectively with engineers and non-engineering stakeholders alike.",Director of Data Engineering,RealTime Recruitment Limited,Staffing & Outsourcing,98861,Glassdoor,GB
44,"Oct 4, 2019","answering phone calls * data inputting on our management information system * maintaining office systems, including data management and filing * removing corrupted data * provide general office support to all staff * attending meetings * organising and managing diaries * performing initial analysis to assess the quality of data * maintaining online systems * extracting data information as and when required requirements and prospects desired skills * excellent communication skills * good organisational skills * good telephone manner * willingness to work as part of a team * experience with word press * general it skills personal qualities * hardworking * punctual and reliable * flexible * work well on their own initiative * smart appearance * friendly * able to relate to people on different levels * willing to listen and learn * not afraid to ask questions desired qualifications gcse or equivalent in english and maths at grades c/4 or above is preferred. future prospects this opportunity comes with the prospect of moving into business management and financial management..",Business Administration / Data Analyst Apprenticeship,"Government jobs, apprenticeship",,155550,Glassdoor,GB
45,"Oct 31, 2019","at least 3 years hands-on experience of data applications development (etl, mr) at scale.at least 3 years experience of building applications and infrastructure in a hadoop big data environment.hands-on development experience in python and scala.experience with kafka. confluent platform (kafka connect, schema registry).experience in one or more of the following technologies: hadoop, spark, hive, pig.outstanding sql query writing abilities and data understanding.excellent communication skills and a team player.",Big Data Engineer,DoubleVerify,Internet,59428,Glassdoor,IL
