posting_date,description,title,employer,industry,id,source,country
2019-08-23,"  software engineering manager reston, va cirium looking software engineering manager based reston, va office cultivate inspire agile software engineering team. position reports sr. director software engineering serves glue engineering teams individuals functional groups across cirium including: engineering, devops / sres, product management, data science, support, sales, marketing finance, also interfacing key external partners data support issues.  software engineering manager provides leadership, direction, vision management data acquisition, data processing data delivery ticketing data, dot traffic financial data, well transforming schedules data input qsi models downstream products. position collaborates product managers others lead teams variety efforts research, design, estimation, implementation, test delivery, covering teams’ software products, features, fixes internal tools. position also works build bench strength developing principal engineers future team leaders. additional responsibilities may include overseeing team budgets, identifying supporting talent, defining resourcing requirements allocations, plus recruiting engineers.  valid passport ability travel occasionally within united states, canada united kingdom required.  qualifications 5+ years professional software development experience. 5+ years data analytics business intelligence experience. 2+ years people management experience. 2+ years project management experience. bs engineering, computer science equivalent experience required; advanced degree preferred. degrees data science, economics, mathematics statistics considered commensurate computer science experience.  non-traditional skills positive attitude ability assume best intent conversations. frequent, open honest communication, written verbal. collaborate remotely global colleagues across time zones. embrace foster culture ownership accountability. recognize, learn celebrate successes failures. knack getting right people room right time. value products projects. care outcomes, output.  traditional technical skills proven track record leading technology resources solve complex business needs. ability leverage technical metrics drive effective team decisions. knowledge large complex systems. knowledge architectural software design principals. proven ability lead test-driven software development maintenance. experience code reviews development approaches. proven ability adapt new roles responsibilities. ability manage teams vague requirements, understanding complex data structures, elements, metrics, algorithms, user stories. experience software development process using agile methodologies, particularly kanban (using jira collaboration tracking tool). excellent skills setting, communicating, implementing, achieving business objectives goals direct management others. excellent project planning, time management plus change risk mitigation skills across multiple functional groups. excellent problem-solving experience identifying, researching coordinating resources necessary effectively troubleshoot/diagnose complex project issues; prior success extracting/translating findings alternatives/solutions; identifying risks/impacts adjustments facilitate management decision-making. strong interpersonal, communication presentation skills applicable wide audience including senior executive management, customers, etc., including diction/terminology presenting information concise effective manner clients, management various organizations using assorted communication mediums. superior collaboration skills experience.  assets hands-on experience software stack, languages tools currently used engineering teams reston portland – namely sql, r, python, sas, kubernetes, docker, aws cloud-based microservice models, athena, glue, spark, s3 data lakes, git/bitbucket, jira, cloudability, datadog, zendesk, etc. professional and/or specialized coding skills. strong excel skills. past experience aviation and/or travel industries, particularly related big data analytics, airline metrics, ticket data, schedules, traffic/on-boards data.  responsibilities responsible leading teams internal external technology resources. ensure contractual kpis slas continually tracked achieved. track squad resource usage budgeted allocations (“bank days”) specific clients, capex opex accounting. provide accurate effort cost estimates custom deliverables professional data services, coordinate financial analyst financial manager fully report invoice custom services. meet exceed operational targets, service-level agreements, estimates, quality and/or cost requirements. make short- long-term decisions relation product development strategies. lead development technical standards perform reviews ensure enterprise architectural standards processes followed. utilize best practices understand emerging trends. recommend technical strategy direction across functional areas. consult stakeholders site reliability engineers find appropriate work-arounds system outages. work directly customers end users. design work complex data models. seek diverse ideas perspectives variety sources create better solutions, products services. carry people management responsibilities accordance organization’s policies, procedures applicable laws. responsibilities include interviewing, hiring, training employees; planning, assigning directing work; appraising performance; rewarding disciplining employees; addressing complaints, mediating disputes resolving problems. ensure staff provided training resources needed perform jobs outstanding degree possible. ensure staff provided frequent feedback coaching, including regular one-on-one sessions, order meet exceed individual team performance goals consistently. manage encourage new ideas engineers others foster improvements innovation. empower engineers accountable responsible actions decisions.  company: cirium provides data services end-to-end data solutions customers serving global travel industry. company established leadership position provider real-time global flight information, serving airlines airports, travel agencies, developers, consumers, more. company leveraging platform domain knowledge developed expand new data sets new products deliver value company’s core markets. work interesting field, demonstrated success do, well positioned future growth.  environment: hire best talent travel technology industries. support talented team, offer extraordinary work environment places trust respect forefront company values. values enable employees best work creating open, supportive environment promotes creativity. employees also provided outstanding benefits encourages healthy life/work balance. enough, offices provide lots natural light include well-stocked refrigerators snack bars! think great place great work, like sound well, encourage consider opening.   rbi equal opportunity employer: qualified applicants considered treated employment without regard race, color, creed, religion, sex, national origin, citizenship status, disability status, protected veteran status, age, marital status, sexual orientation, gender identity, genetic information, characteristic protected law. qualified individual disability disabled veteran needs reasonable accommodation use access online system, individual please contact 1.877.734.1938 accommodations@relx.com. ",Mgr Software Engineering - Data Engineering,Reed Business Information,,0497c80e5170ebfc1948a221d80f3083,Indeed,United States
2019-09-19,"summary objective role translate business questions requirements reports/projections help guide business decisions. candidate would work across departments use technical analytical skills provide insights business. would highly focused position would involve analyses across sales, customer service, plant, pricing, finance data. successful candidate must result-oriented, team player, continuous process improvement mindset. friendly, self-motivated team player strong interpersonal skills necessary role. excellent verbal written communication skills mandatory. essential duties responsibilities include following: identify relevant data sources transform data needed perform analysis perform analysis, often large sets data, extract actionable insights help drive decisions across business interpret data, draw conclusions, communicate recommendations decision makers present analysis simple, accessible manner aid development sophisticated pricing behavioral models develop maintain metrics used across various departments interact sales, marketing, plant management, finance understand reporting needs work management identify opportunities additional business application statistical analysis prepare, run, distribute monthly metrics/reports qualifications: perform job successfully, individual must able perform essential duty satisfactorily. requirements listed representative knowledge, skill, and/or ability required. reasonable accommodations may made enable individuals disabilities perform essential functions. technical requirements: possess analytical ability computer literate superb spreadsheet analysis skills experience sql strongly preferred experience vba strongly preferred familiarity data visualization tools (ex. tableau, microsoft bi) familiarity tibco spotfire plus ability translate high-level business requirements functional specification ability effectively communicate findings clear concise manner management experience working manufacturing environment plus language skills: english required. ability read, analyzes, interpret common scientific technical journals, financial reports, legal documents. ability respond common inquiries complaints customers, regulatory agencies, members business community, employees managers. ability write complex confidential correspondence. ability effectively present information clients, public groups, boards directors, employees, management. mathematical skills: ability work mathematical concepts including: probability statistical inference. ability apply concepts fractions, percentages, ratios, proportions practical situations. reasoning ability: ability define problems, collect data, establish facts, draw valid conclusions. ability interpret extensive variety technical instructions mathematical diagram form deal several abstract concrete variables. ability apply common sense understanding carry instructions either furnished created written/oral form. ability deal problems involving several concrete variables high stress situations. detail oriented multi-tasking abilities. certificates, licenses, registrations, educations/experience:  bachelor’s degree mathematics, statistics, computer science related quantitative discipline 2+ years experience data-related role strongly preferred affinity numbers complex statistical models analytical mindset ability process information logically ability use excel expert level (ex. pivot tables, v-lookups, concatenate, vba) ability read understand sql preferred ",DATA ANALYST - 9153 73,MacLean-Fogg,,95cdf420bab8e1e9cadac54bfbdcda32,Indeed,United States
2019-08-25," join team toilet genius intern - promise making copies pouring coffee! sales analyst intern opening marketing team burlington, wi location. position part vital work marketing department support sales team. ""right fit"" candidate data whiz growth mindset sales marketing, communications, business-related major. successful interns excellent communicators, customer-driven focus, looking challenged. newest sales analyst intern look forward leaving internship hands-on, relevant experience! work learning include: taking deep dive sales & marketing data help drive strong customer-focus. interns learn in-store research, customer interviews, development & execution research projects variety media methods. use microsoft excel, word powerpoint complete analyses assist customer presentations. sales & marketing department uses data measure progress, performance, future opportunities. leave doors able impress friends instructors level excel expertise! part fast-paced team atmosphere values contribution member makes success organization. support growth development, interns exception. ask bring table: ability work 15 – 20 hours per week. flexible around schedule, willingness commit long term internship definite plus. working knowledge microsoft products, particularly excel outlook. able demonstrate high level attention detail working project. ",Sales/Data Analyst Intern - Fall 2019,Lavelle Industries,,5b59f2c49845ce429964b79d7faecf81,Indeed,United States
2019-09-21," job description join us thermo fisher scientific, you’ll part smart, driven team shares passion exploration discovery. revenues $22 billion largest investment r&d industry, give people resources opportunities make significant contributions world. position summary: corporate data marketing analyst passionate transforming marketing data analytics, driving actionable insights enable digital marketers, role! must curious analytics field constantly changes digital must fascinating you. also need critical thinker ability work imperfect data test/learn. reporting corporate marketing working closely digital marketing team, responsible producing reports driving results/roi. ideal candidate strong business acumen, combined marketing analytics background, excellent project management skills. based corporate office pittsburgh, pa. do?  monthly quarterly digital marketing business metrics review providing actionable insights improve performance time. ongoing digital channel reports ad hock deep dives help digital marketing managers optimize efforts. partner corporate marketing leadership business stakeholders define long-term reporting roadmap, identify key drivers influencing marketing metrics, enable divisional reporting capabilities. performs duties assigned.  get here? bachelor’s degree. 1-3 years working digital/marketing and/or sales analytics. minimum 1 year experience building reports/dashboards using powerbi - mandatory. minimum 1 year experience writing sql model data analysis. experience web analytics platforms like adobe analytics google analytics. experience using etl analytics tools alteryx ibm cognos data extraction desired. interpersonal skills: exceptional verbal/written communication, listening presentation skills attention detail. proven track record achieving desired results without direct report authority. minimal travel required <10%.  thermo fisher scientific, one 70,000 extraordinary minds unique story tell. join us contribute singular mission—enabling customers make world healthier, cleaner safer. individual disability requires reasonable accommodation complete part application process, click assistance. thermo fisher scientific eeo/affirmative action employer discriminate basis race, color, religion, sex, sexual orientation, gender identity, national origin, protected veteran status, disability legally protected status. ","Corporate Marketing Data Analyst, Pittsburgh, PA",Thermo Fisher Scientific,,5d19716c7a6af423fd9f618fc7d12cb3,Indeed,United States
2019-09-18," career investigative analytics practice, within forensics technology services, provide opportunity help clients protect business today’s evolving landscape applying advanced strategic approaches information management. focus assisting organisations manage vast amounts electronic data navigate legal business processes demanded critical events includes litigation, regulatory requests internal investigations. team helps design build investigation support systems clients work with, review, provide insights data investigation without need complex data analysis skills without risk damaging underlying evidence. really stand make us ?t future constantly changing world, every one us pwc needs authentic inclusive leader, grades/levels lines service. help us achieve pwc professional; global leadership development framework. gives us single set expectations across lines, geographies career paths, provides transparency skills need individuals successful progress careers, future. senior associate, you’ll work part team problem solvers, helping solve complex business issues strategy execution. pwc professional skills responsibilities management level include limited to: - use feedback reflection develop self awareness, personal strengths address development areas. - delegate others provide stretch opportunities coach help deliver results. - develop new ideas propose innovative solutions problems. - use broad range tools techniques extract insights current trends business area. - review work others quality, accuracy relevance. - share relevant thought leadership. - use straightforward communication, structured way, influencing others. - able read situations modify behavior build quality, diverse relationships. - uphold firm’s code ethics business conduct. job requirements preferences: basic qualifications: minimum degree required: bachelor degree minimum years experience: 3 year(s) preferred qualifications: degree preferred: bachelor degree preferred fields study: management information systems, engineering, accounting, computer information science, mathematics, finance, economics, statistics certification(s) preferred: database programming certifications, oracle, ms sql server; cpa; and/or pmi. certified fraud examiner plus.  preferred knowledge/skills: demonstrates proven thorough knowledge of, and/or success individual contributor supervisory roles involving, forensic technology, forensic accounting and/or technical investigations, preferably global network professional services firms, including following areas: supervising leading work streams involving business transactions management, divestitures, mergers acquisitions; - performing maintaining relational nosql databases, especially utilizing one following environments: data visualization tools - tableau; spotfire, qlikview, etc., r base sasdata analytics - microsoft sql, oracle, informatica; or, vba python; performing erps, especially multiple business accounting cycles, financial reporting activities, data models; understanding industry-specific business processes accounting practices, healthcare, oil gas, utilities, etc.; and, consulting helping manage industry-related data analytics and/or financial management, emphasizing multiple business accounting cycles.  demonstrates thorough level ability and/or proven record success forensic technology, forensic accounting and/or technical investigations, preferably global network professional services firms, including following areas: managing multiple engagements competing priorities rapidly growing, cross-functional, fast-paced, interactive, results-based team environment; leading teams accounting-related business consulting projects translate business accounting requirements technical solutions’ specifications; creating, managing, utilizing high performance relational nosql databases, microsoft sql server, oracle, microsoft access, olap proprietary software; gathering, standardizing, analyzing voluminous transactional electronic data, banking records, general ledgers, sales inventory data, etc.; querying mining large data sets discover transaction patterns, examining financial data filtering targeted information utilize traditional predictive/advanced analytic methodologies; designing developing user interfaces database reports; assisting practice leadership creating proposals, budgets, work-plans, business development activities appropriate; communicating cogently writing, speaking and/or presenting senior management, client personnel, client in-house outside legal counsel, compliance personnel, investigators, vendors subcontractors, team members; and, overseeing project management, including preparing budgets, work plans, status reports, client-ready deliverables.  qualified applicants receive consideration employment pwc without regard race; creed; color; religion; national origin; sex; age; disability; sexual orientation; gender identity expression; genetic predisposition carrier status; veteran, marital, citizenship status; status protected law. pwc proud affirmative action equal opportunity employer.",Data Analyst - Investigative Analytics - Senior Associate,PwC,,188306aeb41efb9a40f99415eb229dac,Indeed,United States
2019-09-20,"about jll we’re jll. we’re professional services investment management firm specializing real estate. fortune 500 company, help real estate owners, occupiers investors achieve business ambitions. nearly 300 corporate offices across 80 countries, team 86,000 individuals. you’re looking step career, jll perfect professional home. us, you’ll chance innovate world’s leading businesses, put expertise action landmark projects, work game-changing real estate initiatives. you’ll also make long-lasting professional connections inspired best. we’re focused opportunity want help make yours. achieve ambitions—join us jll! job involves looking data engineer self-starter work diverse fast-paced environment join enterprise data team. individual contributor role responsible architecting, designing developing data solutions strategic business built latest technologies patterns. global role requires partnering broader jll technology, data, information management (tdim) team country, regional global level utilizing in-depth knowledge data, infrastructure, technologies data engineering experience.  contributes design information infrastructure, data management processes move organization sophisticated, agile robust target state data architecture develop systems ingest, cleanse normalize diverse datasets, develop data pipelines various internal external sources build structure previously unstructured data interfaces internal colleagues external professionals determine requirements, anticipate future needs, identify areas opportunity drive data development develop good understanding data flow & stored organization across multiple applications crm, broker & sales, finance, hr, mdm, ods, data lake, & edw develop data solutions enable non-technical staff make data-driven decisions design & develop data management data persistence solutions application use cases leveraging relational, non-relational databases enhancing data processing capabilities develop pocs influence platform architects, product managers software engineers validate solution proposals migrate architect develop data lake solution store structured unstructured data internal external sources provide technical guidance help migrate colleagues modern technology platform sound like you? apply need be: bachelor’s degree information science, computer science, mathematics, statistics quantitative discipline science, business, social science. hands-on engineering lead curious technology, able quickly adopt change one understands technologies supporting areas cloud computing (aws, azure(preferred), etc.), micro services, streaming technologies, network, security, etc. 3 5 years experience data developer using python-spark, kafka, spark streaming, azure sql server, cosmos db/mongo db, azure event hubs, azure data lake storage, azure search etc. hands-on experience building data pipelines cloud well versed cicd devops process. design & develop data management data persistence solutions application use cases leveraging relational, non-relational databases enhancing data processing capabilities. experience handling un-structured data, working data lake environment, leveraging data streaming developing data pipelines driven events/queues experience building maintaining data warehouse/ data lake production environment efficient etl design, implementation, maintenance team player, reliable, self-motivated, self-disciplined individual capable executing multiple projects simultaneously within fast-paced environment working cross functional teams expect us we’re entrepreneurial, inclusive culture. succeed together—across desk around globe. believe best inspire best, invest supporting other, learning together celebrating success. total rewards program reflects commitment helping achieve ambitions career, recognition, well-being, benefits pay. we’ll offer competitive salary benefits package. us, you’ll develop strengths enjoy career full varied experiences. can’t wait see ambitions take jll. apply today! apply quoting reference [req74412] jll.com/careers. #li #dibot",Data Engineer,JLL,,66c60bb13aecea281fad55cc3cd8636a,Indeed,United States
