posting_date,description,title,employer,industry,id,source,country
2019-09-18," job description:  bank america seeking senior data scientist analytics team digital transformation program within wholesale credit technology.  scope projects include descriptive, predictive prescriptive analytics. cultivate team infrastructure support modeling analyzing loan data wholesale credit business lines. develop value-added analytics solutions support revenue generation, business insight, risk management, operational efficiency, regulatory compliance, loan pricing, pre post-sale loan facility research. solutions must overcome issues complex data (e.g., vldb, multi-structured, ""big data"", etc.) well deployment advanced techniques (e.g., machine learning, text mining, statistical analysis, etc.) deliver insights. determine best practices areas data science machine learning. facilitate use technologies within loan business loan system applications including precision lender wholesale credit business processes. liaise global banking markets enterprise level teams determine best practices firm contribute improving proficiency areas wct, firm generally. work robotics analytics swat team project intake present new technologies relate solutions high roi applications analytics. manage projects project budget.  minimum qualifications  ph.d. degree related field preferred substantial equivalent experience. typically requires minimum 7-10+ years practitioner machine learning financial markets.  shift: 1st shift (united states america) hours per week: 40","Senior Data Scientist, Wholesale Credit Technology",Bank of America,,3705b6bdceec9a65cae63741ecff9989,Indeed,United States
2019-10-22,"senior data engineer overview: weedmaps looking senior data engineer help architect, build, scale, maintain world-class data platform. seeking qualified individual eager ensure ability store, process, analyze data keeps business growth ambitions. would early hire fast growing startup significant impact design implementation engineering vision company team grows. impact make: enterprise-wide data modeling database design, processes procedures data governance, change management, taxonomy management master data management. working engineering teams data sme, provide architecture design, development oversight assistance ensuring holistic data strategy scalable data flow architecture. produce documentation standards guidelines technical functional audiences, data flow architecture documentation related platform services. establishing managing ongoing maturity company's business glossary, driving consistent end-to-end data driven integration strategy. develops metadata management repository strategy manage enterprise information architecture. accomplished: strong data schema modeling, orm modeling, soa domain driven design architecture patterns, building highly scalable secure solutions strong understanding aws infrastructure services, python, java/scala, ruby, elixir similar languages required. expert knowledge various relational non relational database systems (aurora postgres, elasticsearch, redshift, dynamodb, graph databases) exceptional documentation communication skills. bs/ms/phd computer science related field benefits: fully covered medical, dental, vision employee dependents matching 401k, 50% match 6% employee contribution 3 weeks accrued pto 5 immediate sick days accident insurance basic life/ad&d (accidental death dismemberment) voluntary short long term disability flexible spending account catered lunch provided 5 days week equipment need get work done fridge always stocked energy drinks snacks casual work environment, read ""no suit tie required"", free dress nines weedmaps equal opportunity employer. qualified applicants receive consideration employment without regard race, color, religion, sex, sexual orientation, gender identity, gender expression, national origin, protected veteran status, basis protected applicable law, discriminated basis disability. looking smartest passionate people want join team develop services, systems, marketplaces serve marijuana industry decades come. company uses e-verify confirm employment eligibility newly hired employees. learn e-verify, including rights responsibilities, please visitwww.dhs.gov/e-verify ( http://www.dhs.gov/e-verify ). weedmaps: founded 2008, weedmaps leading technology software infrastructure provider cannabis industry. suite cloud-based software data solutions includes point sale, logistics ordering solutions enable customers scale businesses complying complex disparate regulations applicable cannabis industry. addition, platform provides consumers information regarding cannabis products across web mobile platforms, including listing local retailers brands, facilitating product discovery allowing consumers educate cannabis history, uses legal status. headquartered irvine, california, weedmaps employs 400 professionals around world, offices including barcelona, berlin, boston, denver, new york, phoenix toronto. waiting for? join weedmaps team!",Senior Data Engineer- Platform Development,Weedmaps,,0f9d5fecdf07c13820d178bf9a493476,Indeed,United States
2019-10-23," blue skies, data analyst primarily responsible successful completion project activities directed project manager. project activities include understanding customers’ business order complete requirements analysis definition, design solution, prototypes testing, deployment solution post go-live support. data analyst works direction engagement project manager may also required lead small medium engagements. data analyst’s responsibilities fall three major categories: delivery, practice development, sales & marketing. delivery sustain average billable utilization 100% maintain high level customer satisfaction exceeding client expectations self-manage completion assigned activities practice development participate proactively corporate initiatives provide operational support blue skies creation refinement deliverables processes (focused project delivery) sales / sales collaboration & marketing provide sales & business development support assigned maintain expected levels activity within blue skies’ “relationship sales program” position responsibilities: blue skies expects data analyst plan, research analyze business requirements customer; make reasoned decisions assessing details, provide recommendations along risks issues involved alternative. project initiation – participate project onboarding process, assimilate client information project contractual obligations, understand assigned tasks project planning – assist project manager detailed planning assigned activities project execution – successfully complete assigned individual team project tasks throughout project, meeting timelines deliverable quality standards project closure – complete assigned project closure tasks including blue skies’ documentation, templates marketing activities corporate growth – participate corporate initiatives support blue skies’ journey excellence mission required skills experience:  management consulting experience desired master data management (mdm) software implementation experience (informatica, reltio, sap mdg, talend, teradata, etc.) strong analytical, problem solving skills keen attention detail ability collect & interpret large data sets identify patterns & trends ability analyze data report results back relevant members business ability analyze large datasets & write comprehensive reports ability translate business requirements data requirements defining new data collection analysis processes general business process operations understanding (i.e., finance, supply chain, etc.) understanding core data objects (product, customer, vendor) cross-functional impact understanding data gathering, inspecting, cleansing, transforming, modeling/diagramming techniques understanding data integration, data conversion, data profiling data life cycle implementation methodology lifecycle understanding execution ability self-manage effectively excellent verbal written communication skills ability collaborate effectively team ability willingness learn new concepts approaches ms excel sql proficiency support data analysis reporting activities ms powerpoint content development creativity skills friendly, respectful, courteous, selfless modest bachelor’s master’s degree mathematics, computer science, information management statistics job types: full-time, contract experience: data analysis: 3 years (required) location: princeton, nj (required) work authorization: united states (required) contract length: varies contract renewal: likely ",Data Analyst,Blue Skies LLC,,7cae46c9d36b80aa529f2ecd89e37811,Indeed,United States
2019-08-24," overview  position reports director compliance operations and, responsible acquire, manage, analyze data report results trends associated compliance risk enable company quickly precisely align resources. responsibilities include items ensuring data quality, identifying resolving issues data logical mathematical nature, identification trends large datasets; develop automation, reporting self-service capabilities duties assigned. ability source data point sale systems associated databases/data marts needed pre-examination, examination, customer remediation reporting package needs.  responsibilities  analyze data associated customer complaints, issues, regulatory examinations, compliance testing findings along associated products/services, financial data, servicing channel geographical data identify shifts trends level within enterprise hierarchy vertical horizontal views. build produce reporting key risk indicators trends associated compliance risk. take active part development continual improvement processes regarding data quality control, user self-service data access, delivery information across enterprise.   qualifications  equivalent education level required: bachelor degree information systems, computer science, mathematics relevant field. experience required: experience relational databases, data warehouses, data manipulation presentation. 1-3 years experience using tableau, sas and/or packages. experience etl tools. experience data mining techniques. knowledge required: excellent written verbal communications skills would needed communicate person, phone, email; adaptability flexibility changing environment; comfortable working dynamic, high volume, fast-paced environment. ability read, write, evaluate, apply information. ability interact professionally exhibit appropriate social skills. ability understand ensure compliance policies, procedures, laws governing industry/business products. ability develop maintain business relationships. ability communicate people across wide range technical financial knowledge. technical expertise regarding data models database design development. physical requirements: sitting long periods time; standing occasionally; walking; bending; squatting; kneeling; pushing/pulling; reaching; twisting; frequent lifting less 10 lbs., occasional lifting 20 lbs.; typing; data entry; grasping; transferring items hands and/or another person receptacle; use office equipment include computers; ability travel to, physically present at, complete physical requirements position assigned location. travel: 0-10% attire: business casual  other: must eligible work usa able pass background check. ",Jr. Data Analyst Compliance,Advance America,,9496b7c3c645a624aff010c7662337ee,Indeed,United States
2019-10-23,"  req. id: 144857  micron technology’s vision transform world uses information enrich life commitment people, innovation, tenacity, collaboration, customer focus allows us fulfill mission global leader memory storage solutions. means conducting business integrity, accountability, professionalism supporting global community.  smart manufacturing & ai data scientist micron technology, inc., work world-class team data engineers, business intelligence experts, software engineers discover data insights unobservable traditional business solutions. draw broad background data-mining techniques mathematics, statistics, information technology, machine learning, data engineering, design experiments, visualization, text mining discover insightful patterns data. position, take exciting projects across enterprise business processes bring data science methods opportunities sales, supply chain, finance, corporate strategy, marketing, business areas.  responsibilities include, limited to:  strong understanding business strategy develop clear vision data science collaborate data scientists, data engineers business process experts access existing data data warehouse big data environments ability develop, tune, deploy predictive models explain predict business outcomes prepare deliver presentations data visualizations business conclusions   minimum qualifications:  masters computer science, engineering, economics, mathematics, statistics another research science, bs least two years relevant experience strong knowledge experience r, python statistical software familiarity core techniques statistical machine learning, including regularized regression, time series analysis, decision trees, boosting algorithms, neural networks, frequentist bayesian inference, power calculation experimental design, clustering, collaborative filtering, nlp, cross-validation bootstrapping, data visualization strong interpersonal skills maintain positive relationships colleagues proactive collaborate effectively rapidly changing environment   us leader innovative memory solutions, micron helping world make sense data delivering technology transforming world uses information. global brands — micron, crucial ballistix — offer industry’s broadest portfolio. company manufacturing today’s major memory storage technologies: dram, nand, 3d xpoint™ memory. solutions purpose built leverage value data unlock financial insights, accelerate scientific breakthroughs enhance communication around world.  micron benefits employee rewards program, healthcare, paid time (combined sick vacation time), retirement savings plans, paid maternity/paternity leave, employee assistance program, professional development training, workplace wellness programs, micron health clinic (boise only), fitness center / activity rooms (boise only), tuition reimbursement, micron corporate discounts, casual dress attire.  qualified applicants receive consideration employment without regard race, color, religion, sex, sexual orientation, gender identity, national origin, veteran disability status. us sites only: request assistance application process and/or reasonable accommodations, please contact micron’s human resources department 1-800-336-8918 208-368-4748 and/or completing general contact form keywords: boise || idaho (us-id) || united states (us) || technology development || college || regular || engineering || #li-sc2 || tier 4 || ",Data Scientist,Micron,,f94c6314723a7b5e082fcf5b73724021,Indeed,United States
2019-10-22,"  description customer data analyst bmw responsible providing expertise, insight innovation area data management, acquisition enhancement goal providing new insights recommending best practices health digital aspects bmw’s customer experience. incumbent responsible analyzing understanding online marketing, website traffic offline data, partnering various teams grow improve customer experience throughout journey. ensuring data quality, segmentation security data digitally place. ideal candidate work develop strategic data enrichment programs optimize available data targeted marketing activities customer centric platform. duties include analysis quality data capture techniques, educating internal customers relevance data business, championing strategies, identifying data gaps developing best practices identify data opportunities easy report effective digital measurement. incumbent also partner internal teams improve data integrity help develop new innovative ways impact positive customer experience. role work closely field teams, dealer networks, marketing, sales, bmw financial services agency partners needed. qualifications experience bachelor’s degree ideally business, communications, etc. equivalent work experience 7- 10 years working experience leading executing data analytics, data quality engineering data research 4 years applying statistical techniques marketing communications use cases strong understanding data science landscape big data opportunities, data capture methods strong understanding web analytics techniques working digital platforms excellent presentation skills  ",Customer Data Analyst,BMW of North America LLC.,,d0255cd43718ee461e2e0b94b873efeb,Indeed,United States
2019-09-17,"  managerial direction, wide latitude independent judgment initiative, business data analyst manager (bdam) responsible identifying troubleshooting various issues technical business resolution escalation, appropriate. bdam may responsibility supervising analytical staff. specific duties responsibilities include limited to: collects analyzes statistical quantitative data, employing standard data collection statistical techniques, order produce summary descriptive projective results agency decision making. monitors, reviews, controls coordinates subordinates’ activities, assignments, projects cases personal observation, review statistical narrative data, reports, correspondence. compare work completed milestone expectations, meet program unit objectives. prepare, distribute, schedule work activities assignments based knowledge nature duration activities assignments performed. use basic scheduling techniques, desires abilities staff possible, order provide timetable efficient completion unit work adequate coverage hours operation. analyze department business processes existing technology, recommend needed changes enhancement work departments implement solutions. liaison acs develop repair technical tools maintain project reports entire department. lead development delivery in-service training improve timeliness quality case openings, case maintenance case closings connections, wms/ccrs/bics promis troubleshoot problems identified users applications systems impact case openings, case maintenance, payments, medicaid activations, sso incident management tracking system recon ssps tool. initiate follow-up corrective actions, including interface acs provider agency staff, maintain records errors corrected, order reconcile issues resolve problems. participate development design changes applications like connections, wms/ccrs/bics. promis, lts, ssps tool sso incident management tracking system. rate evaluate job performance subordinates observations, record keeping, use appropriate forms, order document employee’s level performance.   minimum qual requirements  1. master’s degree accredited college university, accredited regional, national, professional specialized agencies recognized accrediting bodies u.s. secretary education council higher education accreditation (chea) economics, finance, accounting, business public administration, human resources management, management science, operations research, organizational behavior, industrial psychology, statistics, personnel administration, labor relations, psychology, sociology, human resources development, political science, urban studies closely related field, one year satisfactory full-time professional experience one combination following: working budget large public private concern budget administration, accounting, economic financial administration, fiscal economic research; management methods analysis, operations research, organizational research program evaluation; personnel public administration, recruitment, position classification, personnel relations, labor relations, employee benefits, staff development, employment program planning/administration, labor market research, economic planning, social services program planning/evaluation, fiscal management; related area; 2. baccalaureate degree accredited college university, accredited regional, national, professional specialized agencies recognized accrediting bodies u.s. secretary education council higher education accreditation (chea) three years satisfactory full-time professional experience areas described “1"" above.   additional information  section 424-a new york social services law requires authorized agency inquire whether candidate employment child-caring responsibilities subject child abuse maltreatment report. position open permanent candidates currently serving civil service title associate staff analyst. city new york administration children’s services equal opportunity employers committed diversity   apply  click ""apply now"" button.   residency requirement  new york city residency generally required within 90 days appointment. however, city employees certain titles worked city 2 continuous years may also eligible reside nassau, suffolk, putnam, westchester, rockland, orange county. determine residency requirement applies you, please discuss agency representative time interview.  ",Business and Data Analyst Manager,New York City ADMIN FOR CHILDREN'S SVCS,,25d156a88d3c1ce5c8a27a4cd822bdbe,Indeed,United States
2019-09-17," analyst update internal tracking, create reporting respond escalations within defined responsibilities. main duties / responsibilities build & qa billing/pricing element tables (interchange, auth, data capture, etc.). provide assistance feedback senior data analyst(s) respond operations, product sales escalations. manage card brand 3rd party invoices; query monthly invoices generate p&l reports coordination it/dba commissions/finance teams. build maintain cross-processor interchange code billing descriptor mapping grids (us & canada regions). analyze impact card brand updates/changes production pricing billing elements. develop portfolio specific reporting/metrics using business intelligence tools e.g. ms power bi.  requirements bachelor’s degree preferred. 3+ years financial and/or payments acquiring position. acquiring and/or payment processing industry experience preferred. good understanding clearing settlement concepts (visa, mastercard & pin debit networks). strong proficiency ms office suite; advanced excel must. mysql experience preferred. ability work simultaneously various data sources large datasets. ability deliver tight deadlines work simultaneously multiple projects. ability exercise discretion judgment dealing confidential sensitive data. ability maintain accurate detailed records. ability establish priorities, work team context, manage multiple tasks/projects. help identify gaps and/or optimization opportunities within existing processes. excellent communication skills (oral written). ",Data Analyst,Nuvei,,241bbf20eed4eb84f471f5f6ac81a36d,Indeed,United States
2019-08-23," overview  working part dedicated research team heart fine arts division, individual responsible data input consolidation well management object database. / responsibility partner researcher team build robust database, specialists rely integrity data utilize resource potential business getting.  contract position: december 20, 2019 responsibilities  acting department point person newly identified property, information leads come central point input, upkeep development object database fine arts division. building comprehensive complete lists artists’ oeuvres researching full market history current ownerships works art consolidating intelligence internal sources gathering intelligence external sources centralizing existing internal data  jointly manage object database updating pricing ownership daily entering new intelligence expand database  qualifications  prior data analyst experience strongly preferred exceptional excel proficiency proficiency ms word, outlook general familiarity database management (knowledge sotheby’s systems plus) flexibility work long hours, including evenings weekends sale deadline periods exceptional organizational skills attention detail ability perform multiple tasks simultaneously efficiently meet constant deadlines ability troubleshoot solve problematic situations regular basis strong verbal written communication skills, including excellent phone manner proven client service skills discreet, dependable mature enthusiasm art willingness broaden knowledge knowledge fine art preferred ","(Temporary) Researcher and Data Analyst, Fine Arts",Sotheby’s,,b641bca1c5d68c8b8d71d72be1905a0b,Indeed,United States
