posting_date,description,title,employer,industry,id,source,country
2019-08-23,"  senior data scientist – plymouth, mn job description: formulate apply mathematical modeling analytic methods develop interpret data help optimize business decision making, strategy, processes. oversee optimization projects use advanced analytics techniques like computer vision, machine learning, statistical analysis. explore, connect, mine, analyze internal external data sources. design strategies propose algorithms analyze leverage data existing new sources. develop code models complex projects applying algorithms large structured unstructured datasets. develop predictive data models pattern detection forecasting. develop recommend solutions deliver value various cargill business units functions metrics including operational efficiency, sales effectiveness, sourcing procurement, supply chain optimization. collaborate business stakeholders develop pipeline data science projects align business strategies solve identified business problems. translate complex ambiguous business problems project charters, identifying technical risks project scope. lead cross-disciplinary team data scientists, database specialists, business subject matter experts complete project deliverables time within budget. research industry best practices create new data analytics capabilities improve cargill business decisions. travel required 10% time fulfill job responsibilities needed. qualified applicants apply online.  qualifications required education experience: master’s degree predictive analytics, business analytics, data science, operations research, management information systems, statistics, 3 years experience job offered alternate occupation data scientist, analytics lead, analytics consultant, operations research analyst. required skills: three (3) years experience in: architecting technology stacks employ multiple data science platforms large-scale data analysis; predictive data modeling; advanced analytics methods including regression analysis, clustering, machine learning; statistical software/languages including r python, multiple packages associated languages (including dplyr, cluster, caret, pandas, scikit-learn, nltk); sql.  equal opportunity employer, including disability/vet.  job research development primary location us-mn-wayzata schedule full-time job type standard shift day job ",Senior Data Scientist,Cargill,,3597217852dbb5126237693cfea132c0,Indeed,United States
2019-10-25,"  looker mission bring better insights data-driven decisions every business. everything aimed making sure customers love every aspect looker, products technologies ease business support. looking curiously brilliant individuals join team reinvent data analytics. get data-driven see looker.  we’ve got going (or become) looker expert support internal business analytics. “data analytics” team tasked simplify analytic infrastructure pioneer new techniques implement best practices influence looker used worldwide. going observational analytics predictive prescriptive analytics need perspective! want join team enhance data-driven culture even further. team member supported several analysts, lead enterprise programs analytics.   enterprise programs team dedicated building scalable programs processes support growth longer term health looker’s enterprise customers. key area focus team implement strategic improvements drive process efficiency throughout customer lifecycle ensure scalability enterprise support ecosystem.  need  first projects develop customer engagement model used optimize support processes pre-sales long-term customer success. passionate business operations excited influence business offering thoughtful analysis meaningful insights highly analytical thinker prior experience working customer success role expanded role using data optimize processes relating customer success enjoy collaborating non technical stakeholders use data process analysis understand insights intelligence required engage, manage grow looker’s enterprise programs establish strong relationship primary customer, sr. manager enterprise programs support customer success framework business analysis analyst: use data process understand, measure, optimize enterprise account planning process partnership customers using effective visualizations dashboards demonstrate analytical findings analysis enterprise account health specifically risk identification learn modeling language lookml coding protocols meta maintenance trend analysis & risk identification. example: enterprise support process trouble reduce operational inefficiencies report automation alerting support process management giving stakeholders clear next steps train stakeholders understand leverage self service analytics lead enterprise programs data projects confidence able iterate work based constantly evolving nature business  bring looker  3+ years customer support, success, directly related experience 1+ years experience sql - write aggregate query without looking syntax 1+ years analyst cs-related role experience one bi tools - looker, tableau, advanced excel, sisense, mode, etc advanced skill spreadsheets strong communication skills, ability turn data compelling stories insights, influencing technical non-technical audiences  nice haves  experience working customers ""solving problems"" scenario experience using customer satisfaction measurement change improve process experience working customer support enterprise business business (b2b) context.  #li-sk1  ","Senior Data Analyst, Customer Success",Looker,,70bcd93eef8b6dea90f0a83670454122,Indeed,United States
2019-09-18,"  job id: 153379  oldcastle apg, crh company, leading supplier products north america’s building landscaping markets. products include concrete masonry hardscapes, packaged cement mixes, packaged lawn garden products composite decking products sold variety channels. oldcastle apg innovator behind many industry’s well-known brands including belgard hardscapes, echelon masonry products, sakrete bagged dry-mixes, anchor wall systems, moistureshield composite decking, among others. 195 operating locations 6,500 employees, oldcastle apg operates across 36 states 5 canadian provinces. oldcastle apg u.s. subsidiary crh plc., leading global diversified building materials group.  job summary seeking entry level data analyst responsible reviewing and/or summarizing data goal extracting meaningful information developing data-based conclusions apg leadership. data analyst analyze provide historical, current, predictive views data stored sales, production financial databases. successful candidate turn data information, information insight insight business decisions.   interpreting data, analyzing results using statistical techniques developing implementing data analyses, data collection systems strategies optimize statistical efficiency quality partner analytics architect develop implement databases, data collection systems, data analytics strategies optimize statistical efficiency quality acquiring data primary secondary data sources identifying, analyzing, interpreting trends patterns complex data sets filtering “cleaning” data partnering leadership prioritize business information needs locating defining new process improvement opportunities   experience qualifications   bs mathematics, economics, computer science, information management statistics proven working experience data analyst business data analyst technical experience regarding data models, database design development, data mining segmentation techniques strong knowledge experience reporting packages, databases (sql etc), programming (xml, javascript, etl frameworks) knowledge statistics experience using statistical packages analyzing datasets (r, python) strong analytical skills ability collect, organize, analyze, disseminate significant amounts information attention detail accuracy   crh americas offers   highly competitive base pay comprehensive medical, dental disability benefits programs group retirement savings program health wellness programs culture values opportunity growth, development, internal promotion   crh americas  crh americas long proud heritage one north america’s largest corporations. proud reflection hundreds family businesses, local regional companies mid large sized enterprises together form crh americas family. crh americas operates decentralized, diversified structure, letting work small company environment career opportunities large enterprise.  oldcastle architectural, crh company, great place grow! you’re rewarding challenge, invite take first step apply today! please complete online application profile sent directly appropriate hiring manager. thank interest crh family!  crh americas affirmative action equal opportunity employer.   eoe/vet/disability-if want know more, please click link.  ","Data Analyst - Charlotte, NC",CRH,,a98d3787f6a395eaf1c77a5857c845eb,Indeed,United States
2019-08-23," ccb fast data science, analytics & insights - associate jp morgan chase & co – ccb cdao   jpmorgan chase & co. (nyse: jpm) leading global financial services firm assets $2.6 trillion operations worldwide. firm leader investment banking, financial services consumers small business, commercial banking, financial transaction processing, asset management. component dow jones industrial average, jpmorgan chase & co. serves millions consumers united states many world's prominent corporate, institutional government clients j.p. morgan chase brands. information jpmorgan chase & co. available www.jpmorganchase.com.   chase consumer & community bank (ccb) serves 61 million households 4 million small businesses broad range financial services, including banking, credit cards, auto finance, payments, mortgages, investment advice.  ccb focused analytics solutions team responsible working across ccb develop execute actionable data science analytical solutions consulting-style environment places premium creative problem solving client interaction. role works strategic, highly visible projects internal clients consumer banking, home lending, card service, business banking, auto finance, merchant services. unique opportunity meaningful impact large scale leading financial services firm. role develop data-centric solutions move bottom line firm.  successful candidate self-starter design, plan execute projects meet specific client needs. position offers opportunity to:  apply strategic, analytical data science skills broad range challenges faced enterprise develop deep domain knowledge various financial services products including credit cards, demand deposit accounts, loans, retail operations deepen market knowledge various industries including retail sales, payments, small businesses, consumer credit, investment vehicles, human behavior, operational efficiency financial technologies gain technical expertise cutting edge big data technologies methods (hadoop, spark, hive, impala, python) grow leadership skills managing clients projects, socializing new ideas across firm  responsibilities  § develop, plan, execute analytical projects individual contributor teams  bring order disparate requirements high tolerance ambiguity, strong problem solving ability, excellent client engagement skills pivot quickly client guidance evolves, always keeping ultimate project objective mind. manage evolving project requirements continuously learning quickly on-the-job establish embrace guidelines ensure consistency high quality presentation materials appearance, tone, style collaborate unit managers, end users, developers, stakeholders integrate data discoveries processes operational capabilities § synthesize analytical findings consumption senior business executives  develop preliminary hypotheses rapidly, focusing important insights meet business need story teller capable delivering practical data insights compelling manner actionable senior leadership articulate analytical findings clear concise deliverables, including presentations, discussions, visualizations § become trusted advisor thought leader business data analytical techniques  establish manage relationships clients internal partners develop deep subject matter expertise various financial operational domains support diverse book work invent creative innovative ways answer key business questions leveraging existing data assets creating new ones demonstrate intellectual curiosity solving difficult business problems drive data science analytics strategies jpmis clients partners including recommendations analytical products, services, protocols, standards qualifications  undergraduate advanced degree analytical field (e.g., computer science, economics, mathematics, statistics, engineering, operations research, physics), data bootcamp certification, industry experience analytical roles (e.g., consulting, modeling, data analysis) general, top-tier talent, demonstrated performance history educational background/accomplishments ability work large medium sized project teams, self-directed contributor proven track record detail orientated, innovative, creative, strategic influencer great interpersonal skills proven ability achieve alignment across range different views interests excellent communicator able convey complex information understandable, compelling, persuasive manner senior executives strong aptitude technical concepts ideas thought leader data science analytics define analytical agenda projects, demonstrates ability frame ambiguous business questions analytical plans (e.g., assessing data needs, sourcing files, preparing data, creating new features, evaluating quality, etc.), executes precision - knowledge modern data mining, quantitative research, data science techniques (e.g., decision trees, regressions, machine learning, string similarity, behavioral analytics, look-a-like models) experience across broad range modern data science analytics tools (e.g., sql, hive, hadoop, spark, python, r) financial services background preferred, required experience top tier analytics consulting firm plus ","Associate, Data Scientist",JP Morgan Chase,,14ee71e696dc8995ef39d2ee02a8213c,Indeed,United States
2019-09-28," company overview h2o.ai open source leader ai mission democratize ai everyone. h2o.ai transforming use ai software category-creating visionary open source machine learning platform, h2o. 18,000 companies use open-source h2o mission-critical use cases finance, insurance, healthcare, retail, telco, sales marketing. h2o driverless ai uses ""ai ai"" order provide easier, faster cost-effective means implementing data science. h2o.ai partners leading technology companies nvidia, ibm, aws, intel, microsoft azure google cloud platform proud growing customer base includes capital one, progressive insurance, comcast, walgreens marketaxess. information learn h2o.ai driving ai transformation, visit www.h2o.ai. job summary:  code proficiently least one language used data scientists and/or data engineers, excite learn more? skilled predictive modeling? view communication skills important technical ones? listen needs peers customers adapt need be? competitive drive best be? finish start? assignments given you?  answer ""yes"" questions, potentially could excellent fit join team customer engineering makers h2o.ai. deliver world-class solution experiences customers drive revenue organization. technical projects work include: training advanced machine learning models scale distributed environments, influencing next generation data science tools data products, pioneering ideas products new areas, machine learning interpretability, automatic machine learning, model management, deployment pipelines, gpu computing. responsibilities duties: customer data scientist, part customer success team working closely sales directors to:  problem solve assess technical problems, determine solutions, work internal engineering customer teams resolve demonstrate ml solutions engaging storytelling technical accuracy architect, design, deliver end end machine learning workflows systems data ingestion model deployment provide best practices guidance customers machine learning workflows systems data ingestion model deployment account-related technical activities relationships translate business use cases requirements technical ones communicate effectively diverse audience, including: engineers, business people, executives. audiences large small, interactions in-person online. drive field feedback back product development hands-on technical activities  qualifications skills  bachelor's degree engineering, computer science, mathematics related field. graduate degree plus. 2+ years' experience performing hands data science machine learning knowledge variety machine learning techniques (clustering, decision tree learning, artificial neural networks, etc.) real-world advantages/drawbacks. visualization skills using r, python languages frameworks. knowledge advanced statistical techniques concepts (regression, properties distributions, statistical tests proper usage, etc.) experience applications. 2+ years' experience using statistical computer languages (r, python, etc.) manipulate data draw insights large data sets. 2+ year working data hadoop /or spark ecosystem. desirable: maker mindset, coachable, urge learn/master new technologies.  h2o.ai perks! flexible work hours time off. h2o.ai equal opportunity employer. welcome encourage diversity workplace regardless race, gender, sexual orientation, gender identity, disability veteran status. 1ppi3hq6ww ",Customer Data Scientist (New York),h2o.ai,,baa99cb200fc1f3c4d71147e0d060735,Indeed,United States
2019-10-22," you’ll working multiple systems system integrations. you’ll also building revenue analysis reports forecasting tools, analyzing following types data: revenue forecast client sales lifecycle sales recruitment various ad hoc here’s experience bring you excel excel, google sheets, apps background finance understand corporate financials you’ve worked crm erp systems. hubspot netsuite, preferred strong report creation/generation must experience system integration. experience data gathering plug-ins, preferred. make information easy find understand. make sure data reconciles makes sense end users; take pride work you’ve worked discreetly sensitive information look ways more, better, faster, without compromising quality us order considered role, must fully authorized work employer describes and want be, want hear you! ps - make sure hire people best suited culture, we’ve designed intensive, task-based selection process prepared work hard earn opportunity. job type: full-time ",Finance Data Analyst,NeuroLeadership Institute,,a54d37fc1879454a5c75ffd180ec6cb8,Indeed,United States
2019-09-18,"wayfair's data science team builds algorithmic systems drive business. 8 expansive workstreams (pricing, personalization & recommendations, merchandising, marketing, measurement, b2b, computer vision, operations), 20 specialized subteams, projects span enormously broad minutely specific. projects teams work driven ground - look entrepreneurial individuals want take ownership agenda thrive collaborative team environment. take example (1) determining implement ar technology improve shopping experience versus (2) optimizing diversity sales highlight customer's email. little wayfair data science team touch. work closely stakeholders across business ensure data driven insights collect dust. in-house a/b testing platform rolling code deployments, team quickly clearly see impact work company large. data science generalist full data science life-cycle conception prototyping, testing, deploying, measuring overall business value develop quantitative models, leveraging machine learning advanced data analysis techniques create novel solutions complex business problems integrate algorithmic solutions technical platforms run scale directly change experiences customers site drive measurable business value collaborating business teams change course wayfair uncover deep insights hidden vast repository raw data, provide tactical guidance act findings use data improve decision-making employees, ultimately, enhance experience customers suppliers work team friendly motivated scientists working together build novel solutions business problems  need currently enrolled undergraduate, master's, phd degree program top-tier institution strong academic track record. currently obtaining degree focused within either statistics, economics, mathematics, computer science major heavy quantitative concentration. please include related coursework resume. affinity data along experience leveraging statistics regression analysis plus. experience interest ability quickly learn sql hadoop. experience interest ability quickly pick-up programming skills relevant data science python r. quick learner analytical approach solving problems part team good communication skills. must hard worker enjoys solving challenging problems fast-paced environment.   machine learning engineer projects teams work directly impact customers massive scale. look driven experts passionate machine learning applying solve real business problems scale part collaborative team environment. working projects as: developing novel machine learning models identify latent customer tastes best products highlighted real-time customers. build pipeline scale algorithms determine causal impact different steps customer's journey across millions customers determine drives incremental value iterate across business create machine learning solutions detect product duplicates across millions products catalog scaling solution handle real-time uploading new products partners.  little wayfair machine learning engineers touch. work closely data science teams across business build scale novel solutions business problems via machine learning. in-house a/b testing platform rolling code deployments, team quickly clearly see impact work company large algorithms create directly impact customer's experience. develop scale state-of-the-art machine learning methods address core business problems architect support technical platforms algorithmic engines run scale build end-to-end ml solutions pipelines run real-time, scaling algorithmic insights impact millions wayfair customers full machine learning life-cycle conception prototyping, testing, deploying, measuring overall business value driven work part dynamic team leverage expertise scalable system design, working devops team, part culture engineering practices pilot projects using new open source tools packages enable novel machine learning techniques across company collaborate data scientists create maintainable, scalable debuggable code bringing strong software development practices work team friendly motivated scientists engineers build scale novel solutions business problems  need currently enrolled undergraduate, master's, phd degree program top-tier institution strong academic track record. currently obtaining degree focused within either statistics, economics, mathematics, computer science major heavy quantitative concentration (e.g. mathematics, economics, computer science, engineering, physics, neuroscience, operations research, etc.). please include related coursework resume. intuitive sense quantitative technical work aligns closely business priorities business value ability effectively work technical leads: strong communication skills, ability synthesize conclusions non-experts desire influence technical decisions comfortable data structures, algorithms, programming team environment, e.g. languages python, c++, perl, c, scala, java, bash, etc. tools docker, kafka, jenkins, github, kubernetes, mssql, aws / gcp, etc. high level understanding machine learning (such supervised/unsupervised learning, recommendation systems, reinforcement learning, deep learning, etc.) ability thrive dynamic environment degrees ambiguity bonus points hands on, providing technical leadership driving strategic initiatives team   matter position choose, opportunity play critical role growing company also operating high level executive visibility. team focused creating strategic solutions steer customer behavior, influence key decision making quantify impact within e-commerce space. diverse fun employees enjoy environment strong ownership quick feedback building, experimenting iterating high-impact work. us: wayfair one world's largest online destinations home. whether work global headquarters boston berlin, warehouses offices throughout world, we're reinventing way people shop homes. commitment industry-leading technology creative problem-solving, confident wayfair home rewarding work career. looking rapid growth, constant learning, dynamic challenges, find amazing career opportunities knocking. matter are, wayfair place call home. we're community innovators, risk-takers, trailblazers celebrate differences, know unique perspectives make us stronger, smarter, well-positioned success. value rely collective voices employees, customers, community, suppliers help guide us build better wayfair - world - all. every voice, every perspective matters. that's we're proud equal opportunity employer. discriminate basis race, color, ethnicity, ancestry, religion, sex, national origin, sexual orientation, age, citizenship status, marital status, disability, gender identity, gender expression, veteran status, genetic information.",Data Science - Generalist & Machine Learning Engineer - Full Time Opportunities,Wayfair,,dd568c50cf6b92f9535b210ea6d22196,Indeed,United States
