posting_date,description,title,employer,industry,id,source,country
2019-08-23," position objective: data engineer ii responsible partnering internal external teams track key performance indicators, derive business insights, create reports support protective’s life annuity demand generation activities. position responsible assisting creation review targeted campaign lists marketing activities recommending data collection approaches support targeted marketing. guidance leadership, data engineer ii identify data collection activities use tools collection reporting marketing key performance indicators. using data variety internal external sources, engineer assist development regular reporting deliverables ad-hoc analysis sourcing aggregation data. data engineer also work team members enforce integrity data sets used analysis assist execution routine reporting provide stakeholders insights driving sales. position work closely marketing team members compile data provide high quality data sets inputs regularly scheduled reports ad-hoc requests. includes ability comfortably manage data various formats, including files relational databases partner team members ensure high-quality repeatable reporting process. support tasks ad-hoc data collection reporting guidance senior team members may required.  responsibilities: assists creation targeted campaign lists variety data sources based marketing specifications recommendations. compiles data internal external sources directed use analysis. performs data quality checks ensure data accurate useful input analysis. creates data sources use analysis performance tracking. assists development implementation data collection measurement plans track marketing key performance indicators. direction, participates project activities assist revenue growth customer engagement, including cohort analysis retention analysis.  participates agile marketing activities including stand-up meetings support meetings foster environment collaboration, continuous learning, incremental improvement. effectively communicates & translates key issues management team. develop recommendations data stores order support targeted marketing analytic functions. identifies data sources, designs data stores, implements processes support campaigns reporting. assists marketing partners data enrichment activities, including merging first-party third-party data sources improved business insights. builds maintains strong internal client relationships across business functions. performs duties assigned. strives develop drive initiatives align key corporate values: right thing serve people build trust simplify everything   qualifications: bachelors master’s degree required information technology, computer science, related field. 3-5 years experience actively using microsoft sql server database platforms practical marketing experience banking, insurance financial services required (business intelligence data science experience preferred) significant experience using sql database platforms, along experience using etl tools microsoft ssis talend data integration. demonstrated business experience running reports business intelligence tools power bi tableau advanced skills sql data manipulation transformation. experience data modeling, relational database design, data warehouse design, along practical experience extracting, transforming, outputting data variety sources. experience using excel compiling manipulating data. understanding different file formats (text, csv, etc.) accessing data relational database platforms required. experience marketing automation platforms and/or email platforms (salesforce marketing cloud, adobe campaign, etc.) helpful, required ability derive business insights data prepare visualizations order communicate findings. anticipates customer needs responds quickly professional manner. basic understanding project management concepts knowledge lean principles agile kanban helpful. ability adjust easily changing priorities deadlines. exceptional attention detail; high level organizational, planning, time management skills strong interpersonal, written oral communication skills ability collaborate effectively levels functions, offering ideas and/or solutions projects ability work deadline driven, team environment ",Data Engineer II,Protective Life Corporation,,0610a5633d287bf90e01ae3b6c592529,Indeed,United States
2019-10-22," us: located beautiful santa barbara, hg insights growing data services company, delivering key insights sales marketing departments. we're powered group highly intelligent developers data scientists mandate largest technology install database world. offer casual yet professional environment. get sweat one fitness classes go run along beach two blocks away. find employees riding bikes lunch funk zone hanging one collaboration spaces. passionate jobs get-it-done attitude, yet take seriously. do: looking data scientist software development background. rapidly growing company small focused engineering teams deliver innovative features fast growing market. build big-data systems utilizing cutting edge technologies solutions allow engineers continuously learn develop shipping amazing products. qualities/ experience:  self-learner, hacker, technology advocate work anything amazing engineering skills, way one best engineers know architect, design, code, test, mentor others experience working interesting successful projects thrive fast growing environment excellent written spoken english communication interest machine learning natural language processing  responsible for:  build solutions text classification, entity linking, entity extraction related projects collaborate product development teams build effective solutions develop features databases, backend apps, front end ui, data service (daas) product help architect design large scale enterprise big-data systems work ideas different team members well fix bugs rapidly attend daily stand-up meetings, planning sessions, encourage others, collaborate rapid pace  need:  bs, ms, ph.d. computer science related technical discipline experience natural language processing, preferably commercial setting. machine learning plus. proficient java (3+ years experience recommended) mysql, elasticsearch, esb, hadoop, spark, related data processing/database technologies experience amazon web services (ec2, s3, rds, emr, elb, etc.) experience web services using rest java actual coding experience large distributed environments multiple endpoints complex interactions comfortable agile development environment understanding real world experience using design patterns comfortable programming mac intellij tools  hg insights company equal opportunity employer please note hg insights accept unsolicited resumes recruiters employment agencies. event recruiter agency submitting resume candidate without signed agreement place, explicitly reserve right pursue hire candidates without financial obligation recruiter agency. unsolicited resumes, including submitted directly hiring managers, deemed property hg insights gjly4qoenf ",Associate Data Scientist,HG Insights,,e2dd9f23bab475cb2cea24c3e3f3cb5a,Indeed,United States
2019-09-20,"  we’re looking data analyst – salt lake city understand power (quality) data. elevates user experience, reveals patterns, provides valuable insights direct impact bottom line. that’s we’re looking increase data’s role current strategy. idea good time includes combing brand payment reconciliations, analyzing large data sets, discovering gaps/issues/opportunities sales payment info, want team. data analyst clearlink, you’ll work data warehouse team define units revenue. you’ll take ad hoc reporting assignments departments help improve processes. you’ll develop keen understanding operations communicate findings far wide. breaking day-to-day reconcile payments brand partners run analyze reports find pay gaps, issues, opportunities define units revenue alongside data warehouse team communicate findings brand partners across organization analyze work large data sets excel  need operational experience strong microsoft excel skills analytical/financial skills, sql, macros, data warehouse general understanding sales funnel strong critical thinking problem-solving skills capacity self-manage self-motivate exceptional attention detail ability prioritize multiple projects desire collaborate  offer competitive pay award-winning healthcare coverage wellness programming, including onsite massage therapists, yoga classes, personalized nutrition fitness coaching 401(k) matching investment personal development: tuition reimbursement, leadership programming, opportunities industry conferences influence generous pto work / life integration  clearlink clearlink, sykes company, award-winning digital marketing sales company headquartered salt lake city, utah. clearlink’s leading-edge technology 2,000 digital marketing, sales, data science experts reason it’s trusted partner fortune 500 companies since 2003. clearlink’s people-focused culture recognized internationally strong leadership, business growth, innovative employee initiatives, corporate social responsibility. global leader intelligent cx, clearlink committed providing intuitive, connected, engaging experiences throughout customer journey. past year alone, clearlink people honored dozen awards, including: utah business magazine’s samy awards utah business magazine’s 40 40 awards utah business magazine’s 30 women watch awards utah business magazine’s 20 20s awards utah business magazine’s fast 50 awards search engine land awards, best in-house seo team finalist pr daily digital pr awards, viral campaign award pr daily digital pr awards, media relations campaign award utah diversity connection, large business diversity award stevie awards, achievements health wellness stevie awards, achievements developing promoting women business stevie awards, people-focused ceo year utah business magazine’s ceo year achievers 50 engaged workplaces award women tech council’s shatter list location: salt lake city ",Data Analyst,Clearlink,,7ea61602e562ca353c12c61f1ecd8b99,Indeed,United States
2019-10-24," engine builds technical teams. solutions placement firm shaped decades interaction technical professionals. inspiration continuous learning engagement markets serve, talent represent, teams build. consulting workforce encouraged enjoy career fulfillment form challenging projects, schedule flexibility, paid training/certifications. successful outcomes start finish engine. hiring full time data analyst, conducting analysis data modeling critical business decisions pertaining company's assets strategic look market. duties: preparation analysis data pertaining key business sales product drivers utilize ms sql server extract, model ensure quality significant amounts data perform data modeling ms sql server represent visualizations various reporting tools create, develop, implement t-sql procedures functions review company data monitor/assure appropriate compliance participate monthly/ yearly forecasting services provide insight health program need:  bs debree it, accounting/ finance related. experience may considered lieu completed degree 3+ years experience data analyis, design and/or modeling demonstrated skills reporting analysis using ms excel, powerbi related advanced knowledge t-sql query development, including writing analysis complex queries apply today see engine make difference career! job type: full-time ",Data Analyst,eNGINE,,de46cebab1e5b7f5ccece9ff498cffb1,Indeed,United States
2019-10-25," overview national interstate member great american insurance group. one leading commercial transportation insurers nation, offer risk financing solutions 50 states tailored meet needs wide variety transportation classes. offerings include traditional insurance innovative alternative risk transfer (art) programs, including dozen group captive programs catering niche wheels markets. proud multiple northcoast 99 winner cleveland plain dealer top workplace northeast ohio. talented dedicated team able live company values integrity, transparency, fairness, accountability, empowerment collaboration transaction make. ready join engaging driven team ours, would love hear you! responsibilities contributes / accountable product premium volume growth profitability results within assigned product lines. assists primary product support contact business units, agents, staff. assist interactions relevant departments claims, underwriting, sales/marketing, provides customer service support (i.e. agents, regulators industry groups). may participate business unit, compliance, claims, agency, program reviews audits (i.e. compliance audits, rate/pricing reviews, agency reviews. supports action plans strategic direction functional areas maintain alignment product managers ensure successful development entire product line. supports review, approval, implementation, communication assigned filings ensures compliance statutory requirements. participates developing product rate revisions, underwriting guidelines, manuals, procedures. gathers analyzes data various sources specific product. assists monitoring product performance. provides summary analysis communicates business units. may assist administering training communication materials providing training necessary product / rate changes staff, field, agency personnel. participates development new revised insurance products, policies, required forms ensure compliance regulatory requirements company guidelines. monitors pertinent insurance publications determine impact line business. may include: identifying emerging coverage issues, state regulatory concerns business unit needs. developing action plans, implementing communicating changes appropriate. resolves and/or assists researching, documenting, communicating moderately complex compliance related issues. provides technical advice lower level positions functional areas. may responsibility performance coaching staff may participatory role decisions regarding development, hiring, firing, performance management, pay increases, etc., direct reports. performs duties assigned. qualifications  education: bachelor’s degree equivalent experience.field study: business, liberal arts related disciplineexperience: 2 5 years related underwriting, claims, product experience. progression toward certification area expertise preferred; appropriate certifications could include associate underwriting (au), chartered property casualty underwriter (cpcu), certified insurance counselor (cic), program general insurance (ins), associate risk management (arm), certified licensing professional (clp) applicable designations.",Data Analyst - Passenger Transportation,National Interstate,,be5d682f3aa795582191386b4b6caabb,Indeed,United States
2019-08-23,"  te strongly believe data analytics strategic drivers future success. investing significantly building advanced analytics team. analytics team te part te information solutions (teis) organization responsible driving organic growth leveraging big data advanced analytics. team reports vp chief data officer teis, works closely svp corporate strategy, regular interactions company’s c-suite. data scientist position directly report director data science. exciting journey build scale advanced analytics practice; position apply skills unlock opportunities enable top strategic priorities te. working problems require advanced analytics applications create value diverse business functions supply chain, pricing, industrial iot & digital factory implementation, digital marketing sales growth, impact business units span multiple geographic areas.   responsibilities  work closely business partners engagement managers translate complex strategic problems relevant analytic frameworks.  proactively ask questions understand business intent, problem statement, analytics opportunity end-results used. understand capture implicit assumptions business user.  identify consume relevant structured unstructured data sources (including iot sources manufacturing sensors systems).  identify practical approaches test learn key hypotheses extend analytic insight.  solve problems uncover opportunities statistical machine learning models, algorithms data visualizations (analytical approaches may used include optimization, simulation, regression, mixed models, classification models, machine learning, deep learning).    requirements  must master’s degree data science, predictive analytics, computer science, applied mathematics, statistics, software engineering, physics, related quantitative discipline.  3+ years data science work experience, including demonstrated high-level proficiency applying data techniques solving customer problems.  3+ years experience machine learning, predictive analytics, statistical modeling.  1+ year experience data visualization (e.g. tableau, power bi, qlik, ploty)  proficiency conducting analyses using tools like python, spark, r others within hadoop ecosystem.  rigorous understanding fundamentals statistics, machine learning artificial intelligence using structured unstructured data sets.  demonstrated ability explain document analytics methodology, results insights business partners.  experience using solid, logical, process-oriented approach training testing models.  value phd degree and/or additional relevant industry certifications (in analytics, software platforms, cloud environments, etc.).  experience analytics applications industrial/manufacturing domains.  exposure distributed computing frameworks well cloud technologies.  experience presenting complex quantitative analyses clear precise manner leadership teams.  experience moving prototypes production environment optimizing models production environment.  ",Data Scientist,TE Connectivity,,48e3a33819836278472b43d16bc06a95,Indeed,United States
2019-10-24,"  fun work company people truly believe doing! entry level position whose primary function perform genotyping data quality control format data facilitate report generation delivery. individual internal resource serves link lab operations customer service/sales providing critical data analysis/formatting quality review. position also serve help troubleshooting database management. programming bioinformatics experience required. full training provided. essential skills, duties responsibilities include following.  primary responsibility manage generation, quality accuracy genotypic data work operations facilitate data transmittal customers via lims ftp sites work various groups data reformats/structures order facilitate analysis provide quality control review data including identification quality issues recognize troubleshooting required maintain advanced knowledge genotyping analysis software single platform gains understanding customer needs product manager manage daily workload delivery data provide customer support wide range products procedures time allows work streamline data analysis pipeline proficiency providing input laboratory technicians needed proficiency variety molecular biology techniques and/or familiarity several technology platforms works within budgeted expenses maintains constant focus cost reduction interacts routinely levels management co-workers effective manner meets individual departmental goals objectives works quality manager supports iso procedures including development, documentation execution works new existing customers integrate custom and/or established processes data exchange, sample exchange, invoicing communication, support duties assigned supervisor  education and/or experience: bachelor's degree four-year college university genetics, molecular biology, biology related field.  computer skills: perform job successfully, individual knowledge microsoft excel spreadsheet software microsoft word - word processing software; programs programming languages manipulate large data sets well network browser applications. come part mission matters! inside farm gate dinner plates, neogen protects world’s food supply. variety animal healthcare products, food safety solutions dangerous bacteria, allergens, toxins, drug residues much more, neogen — too.  ",Data Analyst I,Neogen,,cda67fab67c32c24fc138e5825082c8b,Indeed,United States
2019-10-22," eko makes great tech tells great stories, use tech run world's streaming service content interactive. need senior data analyst passionate working cutting edge tech entertainment help us build whole new medium. we’re looking senior data analyst lead charge data-analysis activities. you’ll become key member growing data & insights team, helping us empower data-driven decisions throughout multi-faceted company aspects business (marketing, sales, distribution, creative) scaling partnering world-class leaders fronts. you’ll analyze data discover key insights business impact introduce implement new data analysis methods frameworks improve work process uncover valuable insights work closely marketing sales modeling relevant data drive audience revenue analysis forecasting utilize merge 1st & 3rd party data sources provide guidance expertise teams running online tests encourage empower data-driven business decisions achieve company goals provide guidance data analysis collaborators inside outside data team you’re passionate, innovative open minded individual easily shift seeing big picture diving details love collaborating smart people great communicator feel extremely comfortable data tools technical ability build analyze complex data models various inputs least 4 years experience analyst role digital space bachelor's degree business analytics related profession - advantage believe viewer-centric, actually-interactive entertainment going change way live, partner major studios, creators, talent, brands make reality. authoring tool available (for free) eko studio, independent creators making waves content. investors include innovation endeavors, intel capital, mgm, nea, samsung, sequoia capital, sony pictures, warner music group, wpp, walmart. company based nyc offices tel aviv. eko, believe we're artists. committed building diverse inclusive workforce, represent everyone trying build creative future. equal opportunity employer, considering candidates employment regardless race, color, religion, sex, national origin, citizenship, age, disability, marital status, military veteran's status (including protected veterans), sexual orientation, gender identity, protected class. ",Senior Data Analyst,Eko,,3c3a0c6008181d46ca7ad439fc1d1861,Indeed,United States
